{
  "recommended_topic": "styleiswhat",
  "trending_topics": [
    "styleiswhat",
    "fashiondiaries",
    "londonblogger"
  ],
  "recommended_hashtags": [
    "#styleiswhat",
    "#man",
    "#fashiondiaries",
    "#pretty",
    "#petitestyle",
    "#londonblogger",
    "#wearthisnext",
    "#hypebeast"
  ],
  "hashtag_details": [
    {
      "hashtag": "#styleiswhat",
      "relevance": 0.4732310175895691,
      "trend_score": 0.9757343550446999,
      "trend_direction": "falling",
      "historical_engagement": 0.08188509597741418,
      "score": 0.7187435858397992
    },
    {
      "hashtag": "#man",
      "relevance": 0.5293636322021484,
      "trend_score": 0.8212005108556832,
      "trend_direction": "stable",
      "historical_engagement": 0.0667103628984711,
      "score": 0.6693566471575757
    },
    {
      "hashtag": "#fashiondiaries",
      "relevance": 0.5334689021110535,
      "trend_score": 0.8952745849297573,
      "trend_direction": "stable",
      "historical_engagement": 0.05499672999411405,
      "score": 0.6247533141049102
    },
    {
      "hashtag": "#pretty",
      "relevance": 0.5933139324188232,
      "trend_score": 0.8033205619412516,
      "trend_direction": "stable",
      "historical_engagement": 0.04121959395917453,
      "score": 0.6127437069672619
    },
    {
      "hashtag": "#petitestyle",
      "relevance": 0.4761490821838379,
      "trend_score": 0.8275862068965517,
      "trend_direction": "rising",
      "historical_engagement": 0.07106738494924725,
      "score": 0.6022284600641672
    },
    {
      "hashtag": "#londonblogger",
      "relevance": 0.48828986287117004,
      "trend_score": 0.8939974457215837,
      "trend_direction": "falling",
      "historical_engagement": 0.06274125774514762,
      "score": 0.5922069735985538
    },
    {
      "hashtag": "#wearthisnext",
      "relevance": 0.45785805583000183,
      "trend_score": 0.6743295019157088,
      "trend_direction": "rising",
      "historical_engagement": 0.08022789489704871,
      "score": 0.5768645805110184
    },
    {
      "hashtag": "#hypebeast",
      "relevance": 0.6187852621078491,
      "trend_score": 0.10217113665389528,
      "trend_direction": "stable",
      "historical_engagement": 0.06260568897664848,
      "score": 0.5623122860560187
    }
  ],
  "recommended_content_type": {
    "value": "carousel",
    "median_relative_engagement_by_type": {
      "image": 1.0,
      "carousel": 1.0311614730878187
    }
  },
  "predicted_engagement": {
    "value": 0.03190186347298091,
    "unit": "engagement_rate",
    "label": "Medium"
  },
  "recommended_posting_time": {
    "day": "Sunday",
    "start": "01:00",
    "end": "02:00",
    "timezone": "UTC"
  },
  "data_basis": {
    "dataset": "Kim et al., WWW '20",
    "data_period": "2012-02-12 to 2019-05-15",
    "reference_date": "2019-05-15",
    "data_type": "historical",
    "category": "fashion",
    "category_match": "matched"
  },
  "model_version": "v1.0",
  "generated_at": "2026-09-27T12:11:10.020417+00:00"
}