{
  "recommended_topic": "campingwithdogs",
  "trending_topics": [
    "frenchbulldog",
    "dogsthathike",
    "catlover"
  ],
  "recommended_hashtags": [
    "#campingwithdogs",
    "#dogsthathike",
    "#frenchbulldog",
    "#pets",
    "#dogs",
    "#sustainableliving",
    "#catlover",
    "#pet"
  ],
  "hashtag_details": [
    {
      "hashtag": "#campingwithdogs",
      "relevance": 0.3928920328617096,
      "trend_score": 0.8707782672540382,
      "trend_direction": "rising",
      "historical_engagement": 0.07108950646181715,
      "score": 0.8525580223867781
    },
    {
      "hashtag": "#dogsthathike",
      "relevance": 0.3752288818359375,
      "trend_score": 0.9016152716593245,
      "trend_direction": "falling",
      "historical_engagement": 0.06909203208727115,
      "score": 0.7942172271938894
    },
    {
      "hashtag": "#frenchbulldog",
      "relevance": 0.3782654106616974,
      "trend_score": 0.9151248164464023,
      "trend_direction": "falling",
      "historical_engagement": 0.05484457981075629,
      "score": 0.6962688432705983
    },
    {
      "hashtag": "#pets",
      "relevance": 0.4063897132873535,
      "trend_score": 0.8208516886930984,
      "trend_direction": "falling",
      "historical_engagement": 0.04083145962308782,
      "score": 0.6373602500869326
    },
    {
      "hashtag": "#dogs",
      "relevance": 0.4359340965747833,
      "trend_score": 0.504258443465492,
      "trend_direction": "stable",
      "historical_engagement": 0.044029367747499035,
      "score": 0.6371503718332202
    },
    {
      "hashtag": "#sustainableliving",
      "relevance": 0.4268445074558258,
      "trend_score": 0.5923641703377386,
      "trend_direction": "rising",
      "historical_engagement": 0.041199936363357934,
      "score": 0.6192979342339997
    },
    {
      "hashtag": "#catlover",
      "relevance": 0.3820008635520935,
      "trend_score": 0.8775330396475771,
      "trend_direction": "falling",
      "historical_engagement": 0.04115983471804047,
      "score": 0.5862409939904427
    },
    {
      "hashtag": "#pet",
      "relevance": 0.4142371714115143,
      "trend_score": 0.5756240822320118,
      "trend_direction": "stable",
      "historical_engagement": 0.04118505163770071,
      "score": 0.5746258404627632
    }
  ],
  "recommended_content_type": {
    "value": "carousel",
    "median_relative_engagement_by_type": {
      "image": 1.0,
      "carousel": 1.025531914893617
    }
  },
  "predicted_engagement": {
    "value": 0.01868230570195857,
    "unit": "engagement_rate",
    "label": "Low"
  },
  "recommended_posting_time": {
    "day": "Thursday",
    "start": "06:00",
    "end": "07:00",
    "timezone": "UTC"
  },
  "data_basis": {
    "dataset": "Kim et al., WWW '20",
    "data_period": "2012-02-12 to 2019-05-15",
    "reference_date": "2019-05-15",
    "data_type": "historical",
    "category": "all",
    "category_match": "fallback_all"
  },
  "model_version": "v1.0",
  "generated_at": "2026-09-27T12:11:09.271438+00:00"
}