{
  "recommended_topic": "styleiswhat",
  "trending_topics": [
    "yogalove",
    "styleiswhat",
    "igyoga"
  ],
  "recommended_hashtags": [
    "#styleiswhat",
    "#proud",
    "#fitgirl",
    "#yogalove",
    "#igyoga",
    "#yogaeverywhere",
    "#yogajourney",
    "#wellnessblogger"
  ],
  "hashtag_details": [
    {
      "hashtag": "#styleiswhat",
      "relevance": 0.3735876679420471,
      "trend_score": 0.9224669603524229,
      "trend_direction": "falling",
      "historical_engagement": 0.07895904322096366,
      "score": 0.6818231899231513
    },
    {
      "hashtag": "#proud",
      "relevance": 0.5011096000671387,
      "trend_score": 0.8279001468428782,
      "trend_direction": "stable",
      "historical_engagement": 0.042541847817156385,
      "score": 0.6766575815078034
    },
    {
      "hashtag": "#fitgirl",
      "relevance": 0.5218222737312317,
      "trend_score": 0.28810572687224667,
      "trend_direction": "falling",
      "historical_engagement": 0.0482824138077864,
      "score": 0.5705484483453966
    },
    {
      "hashtag": "#yogalove",
      "relevance": 0.4380308985710144,
      "trend_score": 0.9985315712187959,
      "trend_direction": "falling",
      "historical_engagement": 0.0351032582401918,
      "score": 0.5650396362828969
    },
    {
      "hashtag": "#igyoga",
      "relevance": 0.43688657879829407,
      "trend_score": 0.8311306901615272,
      "trend_direction": "falling",
      "historical_engagement": 0.044080760186869565,
      "score": 0.5613949279729946
    },
    {
      "hashtag": "#yogaeverywhere",
      "relevance": 0.5148961544036865,
      "trend_score": 0.45198237885462555,
      "trend_direction": "rising",
      "historical_engagement": 0.03672662340044261,
      "score": 0.541408682437834
    },
    {
      "hashtag": "#yogajourney",
      "relevance": 0.4676228165626526,
      "trend_score": 0.6070484581497797,
      "trend_direction": "stable",
      "historical_engagement": 0.04091869383706271,
      "score": 0.5267384151812025
    },
    {
      "hashtag": "#wellnessblogger",
      "relevance": 0.357478529214859,
      "trend_score": 0.6957415565345081,
      "trend_direction": "stable",
      "historical_engagement": 0.07121758028217201,
      "score": 0.5264840844495607
    }
  ],
  "recommended_content_type": {
    "value": "carousel",
    "median_relative_engagement_by_type": {
      "image": 1.0,
      "carousel": 1.025531914893617
    }
  },
  "predicted_engagement": {
    "value": 0.018682305701958567,
    "unit": "engagement_rate",
    "label": "Low"
  },
  "recommended_posting_time": {
    "day": "Thursday",
    "start": "06:00",
    "end": "07:00",
    "timezone": "UTC"
  },
  "data_basis": {
    "dataset": "Kim et al., WWW '20",
    "data_period": "2012-02-12 to 2019-05-15",
    "reference_date": "2019-05-15",
    "data_type": "historical",
    "category": "all",
    "category_match": "fallback_all"
  },
  "model_version": "v1.0",
  "generated_at": "2026-09-27T12:11:09.681863+00:00"
}