{
  "recommended_topic": "portraits",
  "trending_topics": [
    "ootdbloggers",
    "brandambassador",
    "inspirational"
  ],
  "recommended_hashtags": [
    "#portraits",
    "#photography",
    "#ootdbloggers",
    "#brandambassador",
    "#inspirational",
    "#femaleentrepreneur",
    "#workout",
    "#indianblogger"
  ],
  "hashtag_details": [
    {
      "hashtag": "#portraits",
      "relevance": 0.21517197787761688,
      "trend_score": 0.8384728340675477,
      "trend_direction": "falling",
      "historical_engagement": 0.06413191893750278,
      "score": 0.8197671899831773
    },
    {
      "hashtag": "#photography",
      "relevance": 0.2270786464214325,
      "trend_score": 0.6431718061674009,
      "trend_direction": "stable",
      "historical_engagement": 0.051457739991315,
      "score": 0.6933871924179743
    },
    {
      "hashtag": "#ootdbloggers",
      "relevance": 0.16646155714988708,
      "trend_score": 0.9809104258443465,
      "trend_direction": "stable",
      "historical_engagement": 0.06488546841577082,
      "score": 0.6806831542477012
    },
    {
      "hashtag": "#brandambassador",
      "relevance": 0.20925688743591309,
      "trend_score": 0.879295154185022,
      "trend_direction": "rising",
      "historical_engagement": 0.04611187058439144,
      "score": 0.6590319861226509
    },
    {
      "hashtag": "#inspirational",
      "relevance": 0.21591916680335999,
      "trend_score": 0.8751835535976505,
      "trend_direction": "falling",
      "historical_engagement": 0.03497239162035635,
      "score": 0.5907596523437786
    },
    {
      "hashtag": "#femaleentrepreneur",
      "relevance": 0.24633972346782684,
      "trend_score": 0.28634361233480177,
      "trend_direction": "rising",
      "historical_engagement": 0.040458040301550736,
      "score": 0.5545352439686798
    },
    {
      "hashtag": "#workout",
      "relevance": 0.21313506364822388,
      "trend_score": 0.626431718061674,
      "trend_direction": "rising",
      "historical_engagement": 0.04183427731046892,
      "score": 0.5510919975261327
    },
    {
      "hashtag": "#indianblogger",
      "relevance": 0.1717904508113861,
      "trend_score": 0.8023494860499266,
      "trend_direction": "stable",
      "historical_engagement": 0.05353414870823997,
      "score": 0.5449052379874892
    }
  ],
  "recommended_content_type": {
    "value": "carousel",
    "median_relative_engagement_by_type": {
      "image": 1.0,
      "carousel": 1.025531914893617
    }
  },
  "predicted_engagement": {
    "value": 0.01868230570195858,
    "unit": "engagement_rate",
    "label": "Low"
  },
  "recommended_posting_time": {
    "day": "Thursday",
    "start": "06:00",
    "end": "07:00",
    "timezone": "UTC"
  },
  "data_basis": {
    "dataset": "Kim et al., WWW '20",
    "data_period": "2012-02-12 to 2019-05-15",
    "reference_date": "2019-05-15",
    "data_type": "historical",
    "category": "all",
    "category_match": "fallback_all"
  },
  "model_version": "v1.0",
  "generated_at": "2026-09-27T12:11:09.434990+00:00"
}